{
  "$schema": "../../../schema/muck.schema.json",
  "id": "com.example.untrusted-demo",
  "name": "Untrusted Demo",
  "version": "0.1.0",
  "license": "MIT",
  "summary": "Community-style sample used to demonstrate the third-party trust warning.",
  "description": "Not an official Muck Store program. Installing it in production should show the trust warning.",
  "categories": ["sample"],
  "tags": ["community", "demo"],
  "source": {
    "github": "example/untrusted-demo"
  },
  "entry": "demo.ps1",
  "install": {
    "kind": "portable"
  },
  "permissions": ["network", "filesystem"]
}
